{"hashAlg":"xxh128","manifestVersion":"2023-03-03","paths":[{"hash":"CarriageReturn","mtime":1679079744833848,"path":"\r","size":1},{"hash":"One","mtime":1679079344833868,"path":"1","size":1},{"hash":"c","mtime":1675079344833848,"path":"another_test_file","size":1},{"hash":"b","mtime":1479079344833848,"path":"test_dir/test_file","size":1},{"hash":"a","mtime":167907934333848,"path":"test_file","size":1},{"hash":"Control","mtime":1679079344833348,"path":"\u0080","size":1},{"hash":"LatinSmallLetterOWithDiaeresis","mtime":1679079344833848,"path":"\u00f6","size":1},{"hash":"EuroSign","mtime":1679079344836848,"path":"\u20ac","size":1},{"hash":"EmojiGrinningFace","mtime":1679579344833848,"path":"\ud83d\ude00","size":1},{"hash":"HebrewLetterDaletWithDagesh","mtime":1679039344833848,"path":"\ufb33","size":1}],"totalSize":10}